<?xml version = "1.0" encoding = "UTF-8" ?>
<!DOCTYPE pise PUBLIC "pise2.dtd" "pise2.dtd"  [
<!ENTITY runtime_tg PUBLIC "run_time2.xml.in" "run_time2.xml.in" >
]>
<!-- Created by Mark Miller for CryoEM project around 5/24/2016-->
<pise>
  <head>
    <title>AlphaFold2 Multimer</title>
    <version>1.0</version>
    <description>Highly accurate protein structure prediction with AlphaFold Multimer</description>
    <authors>Evans et al. </authors>
    <reference>https://www.biorxiv.org/content/10.1101/2021.10.04.463034v1</reference>
    <category>Protein structure prediction</category>
    <doclink>https://github.com/deepmind/alphafold</doclink>
  </head>

  <command>alphafoldmultimer</command>

<parameters>
<!-- command name: this parameter precedes all instruction strings -->
    <parameter ishidden="1" type="String"> 
	  <name>relion_invoke</name>
	  <attributes>
	    <format>
		  <language>perl</language>
		  <code>"alphafold2multimer"</code>
		</format>
		<group>0</group>
	  </attributes>
	</parameter> 
	  
<!-- build the conf file -->
	<parameter ishidden="1" type="String">
		<name>relion_scheduler</name>
		<attributes>
			<paramfile>scheduler.conf</paramfile>
			<format>
				<language>perl</language>
				<code>
<!-- RUN THESE JOBS ON Comet -->
				 "gpu=2\\n" . 
				 "runhours=12\\n" . 
			     "ntasks-per-node=1\\n" .
				 "nodes=1\\n"
				</code>
			</format>
			<group>1</group>
		</attributes>
	</parameter>	

<!-- create the non-configurable command line -->
<!--  -->
	<parameter ishidden="1" type="String">
		<name>relion_commandline</name>
		<attributes>
			<group>1</group>
		</attributes>
	</parameter>	

<!-- required input file, this is selected outside the parameters gui -->
    <parameter isinput = "1" type = "InFile">
	  <name>infile</name>
	  <attributes>
	    <prompt>FASTA file</prompt>
		<format>
		  <language>perl</language>
		  <code>"--fasta_paths=\"$value\""</code>
		</format>
	    <group>90</group>
	  </attributes>	  
	</parameter>
	
    <parameter type="Results">
      <name>stderr.txt</name>
      <attributes>
        <filenames>stderr</filenames>
      </attributes>
    </parameter>

	<parameter type="Results">
      <name>Input FASTA file</name>
      <attributes>
        <filenames>*.fasta</filenames>
      </attributes>
    </parameter>

    <parameter type="Results">
      <name>Predicted structural models</name>
      <attributes>
        <filenames>output_dir/*/*relaxed*pdb</filenames>
      </attributes>
    </parameter>

	<parameter type="Results">
      <name>Diagnostic plots for each predicted model</name>
      <attributes>
        <filenames>output_dir/*/*.png</filenames>
      </attributes>
    </parameter>

	<parameter type="Results">
      <name>Full output from AlphaFold (compressed)</name>
      <attributes>
        <filenames>*.tar.gz</filenames>
      </attributes>
    </parameter>

	<parameter type="Results">
      <name>Ranking of AlphaFold models</name>
      <attributes>
        <filenames>output_dir/*/*anking_debug.json</filenames>
      </attributes>
    </parameter>

<!-- visible input parameters -->	

	<parameter type="Excl" issimple="1" ismandatory="1">
	    <name>db_preset</name>
	    <attributes>
		    <group>1</group>
		    <prompt>Database</prompt>
		    <format>
			    <language>perl</language>
			    <code>"--db_preset=$value"</code>
		    </format>
            <vdef>
                <value>full_dbs</value>
            </vdef>
            <vlist>
                <value>reduced_dbs</value>
                <label>reduced_dbs</label>
                <value>full_dbs</value>
                <label>full_dbs</label>
            </vlist>
	    </attributes>
    </parameter>
	<parameter type="Excl" issimple="1" ismandatory="1" ishidden="1">
	    <name>model_preset</name>
	    <attributes>
		    <group>1</group>
		    <prompt>Database</prompt>
		    <format>
			    <language>perl</language>
			    <code>"--model_preset=multimer"</code>
		    </format>
            <vdef>
                <value>multimer</value>
            </vdef>
            <vlist>
                <value>monomer</value>
                <label>monomer</label>
                <value>monomer_casp14</value>
                <label>monomer_casp14</label>
                <value>monomer_ptm</value>
                <label>monomer_ptm</label>
                <value>multimer</value>
                <label>multimer</label>
            </vlist>
	    </attributes>
    </parameter>
    <parameter type="Switch" issimple="1" ismandatory="1" ishidden="1">
        <name>relaxrun</name>
        <attributes>
            <group>1</group>
            <prompt>Skip calculating relaxed models</prompt>
            <format>
                <language>perl</language>
                <code>" --relaxrun=False"</code>
            </format>
            <vdef>
                <value>1</value>
            </vdef>
        </attributes>
    </parameter>

</parameters>

</pise>
