<?xml version = "1.0" encoding = "UTF-8" ?>
<!DOCTYPE pise PUBLIC "pise2.dtd" "pise2.dtd"  [
<!ENTITY runtime_tg PUBLIC "run_time2.xml.in" "run_time2.xml.in" >
]>
<!-- Created by Mark Miller for CryoEM project around 5/24/2016-->
<pise>
  <head>
    <title>ColabFold</title>
    <version>1.5.2</version>
    <description>Fast and convenient protein structure predictions using MMseqs2 and AlphaFold</description>
    <authors>Mirdita et al. </authors>
    <reference>https://www.nature.com/articles/s41592-022-01488-1</reference>
    <category>Protein structure prediction</category>
    <doclink>https://github.com/deepmind/alphafold</doclink>
  </head>

  <command>colabfold</command>

<parameters>
<!-- command name: this parameter precedes all instruction strings -->
    <parameter ishidden="1" type="String"> 
	  <name>relion_invoke</name>
	  <attributes>
	    <format>
		  <language>perl</language>
		  <code>"colabfold"</code>
		</format>
		<group>0</group>
	  </attributes>
	</parameter> 
	  
<!-- build the conf file -->
	<parameter ishidden="1" type="String">
		<name>relion_scheduler</name>
		<attributes>
			<paramfile>scheduler.conf</paramfile>
			<format>
				<language>perl</language>
				<code>
<!-- RUN THESE JOBS ON Comet -->
				 "gpus=1\\n" . 
				 "cpus=10\\n" . 
				 "memory=90G\\n" . 
				 "runhours=48\\n" . 
			     "ntasks-per-node=1\\n" .
				 "nodes=1\\n"
				</code>
			</format>
			<group>1</group>
		</attributes>
	</parameter>	

<!-- create the non-configurable command line -->
<!--  -->
	<parameter ishidden="1" type="String">
		<name>relion_commandline</name>
		<attributes>
			<group>1</group>
		</attributes>
	</parameter>	

<!-- required input file, this is selected outside the parameters gui -->
    <parameter isinput = "1" type = "InFile">
	  <name>infile</name>
	  <attributes>
	    <prompt>FASTA file</prompt>
		<format>
		  <language>perl</language>
		  <code>"--fasta_path=\"$value\""</code>
		</format>
	    <group>90</group>
	  </attributes>	  
	</parameter>

	<parameter type="Integer" issimple="1" ismandatory="1">
      <name>num_models</name>
      <attributes>
        <group>1</group>
        <prompt>Number of models</prompt>
        <format>
          <language>perl</language>
          <code>"--num_models=$value"</code>
        </format>
        <vdef>
          <value>5</value>
        </vdef>
        <ctrls>
          <ctrl>
            <message>Please enter an integer > 0 for the number of models to use</message>
            <language>perl</language>
            <code>$num_models &lt; 0</code>
          </ctrl>
        </ctrls>
      </attributes>
    </parameter>

 	<parameter type="Integer" issimple="1" ismandatory="1">
	  <name>num_recycles</name>
	  <attributes>
        <group>1</group>
	    <prompt>Number of Recycles</prompt>
	    <format>
	      <language>perl</language>
	      <code>"--num_recycles=$value"</code>
        </format>
	    <vdef>
	      <value>3</value>
	    </vdef>
	    <ctrls>
	      <ctrl>
	        <message>Please enter an integer > 0 for the number of recycles to use</message>
	        <language>perl</language>
	        <code>$num_recycles &lt; 0</code>
	      </ctrl>
	    </ctrls>
	  </attributes>
	</parameter>
	
	<parameter type="Integer" issimple="1" ismandatory="1">
      <name>stop_score</name>
      <attributes>
        <group>1</group>
        <prompt>Stop at score (Compute recycle models until plddt (single chain) or ptmscore (complex) > threshold is reached.) Leave blank to use all recyles.</prompt>
        <format>
          <language>perl</language>
          <code>"--stop_at_score=$value"</code>
        </format>
		<vdef>
          <value>80</value>
        </vdef>
      </attributes>
    </parameter>

 	<parameter type="Switch">
	  <name>use_amber</name>
	  <attributes>
        <group>1</group>
	    <prompt>Use Amber molecular dynamics relaxation?</prompt>
	    <format>
	      <language>perl</language>
	      <code>"--use_amber=$value"</code>
        </format>
	    <vdef>
	      <value>0</value>
	    </vdef>
	  </attributes>
	</parameter>

 	<parameter type="Switch" issimple="1">
	  <name>use_templates</name>
	  <attributes>
        <group>1</group>
	    <prompt>Use templates from published PDB structures?</prompt>
	    <format>
	      <language>perl</language>
	      <code>"--use_templates=$value"</code>
        </format>
	    <vdef>
	      <value>0</value>
	    </vdef>
	  </attributes>
	</parameter>

	<parameter type="Excl" ismandatory="1" ishidden="0">
        <name>maxmsa</name>
        <attributes>
            <group>1</group>
            <prompt>Max MSA depth (smaller values to increase uncertainty)</prompt>
            <format>
                <language>perl</language>
                <code>"--max_msa=$maxmsa"</code>
            </format>
            <vdef>
                <value>auto</value>
            </vdef>
            <vlist>
                <value>auto</value>
                <label>auto</label>
                <value>512:1024</value>
                <label>512:1024</label>
                <value>256:512</value>
                <label>256:512</label>
                <value>64:128</value>
                <label>64:128</label>
				<value>32:64</value>
                <label>32:64</label>
				<value>16:32</value>
                <label>16:32</label>
            </vlist>
        </attributes>
    </parameter>

    <parameter type="Results">
      <name>stderr.txt</name>
      <attributes>
        <filenames>stderr</filenames>
      </attributes>
    </parameter>

	<parameter type="Results">
      <name>Input FASTA file</name>
      <attributes>
        <filenames>*.fasta</filenames>
      </attributes>
    </parameter>

    <parameter type="Results">
      <name>Predicted structural models</name>
      <attributes>
        <filenames>output/*relaxed*pdb</filenames>
      </attributes>
    </parameter>

	<parameter type="Results">
      <name>Diagnostic plots for each predicted model</name>
      <attributes>
        <filenames>output/*.png</filenames>
      </attributes>
    </parameter>

	<parameter type="Results">
      <name>Full output from AlphaFold (compressed)</name>
      <attributes>
        <filenames>*.tar.gz</filenames>
      </attributes>
    </parameter>

	<parameter type="Results">
      <name>Ranking of AlphaFold models</name>
      <attributes>
        <filenames>output/*scores.json</filenames>
      </attributes>
    </parameter>

	<parameter type="Results">
      <name>Predicted error of AlphaFold models</name>
      <attributes>
        <filenames>output/*error_v1.json</filenames>
      </attributes>
    </parameter>

	<parameter type="Results">
      <name>Citation file</name>
      <attributes>
        <filenames>output/cite.bibtex</filenames>
      </attributes>
    </parameter>
<!--
	<parameter type="Results">
      <name>A3M</name>
      <attributes>
        <filenames>output_dir/*.a3m</filenames>
      </attributes>
    </parameter>
 -->

<!-- visible input parameters -->	


</parameters>

</pise>
