<?xml version = "1.0" encoding = "UTF-8" ?>
<!DOCTYPE pise PUBLIC "pise2.dtd" "pise2.dtd"  [
<!ENTITY runtime_tg PUBLIC "run_time2.xml.in" "run_time2.xml.in" >
]>
<!-- Created by Mark Miller for CryoEM project around 5/24/2016-->
<pise>
  <head>
    <title>OmegaFold</title>
    <version>1.0.2</version>
    <description>High-resolution de novo Structure Prediction from Primary Sequence</description>
    <authors>Ruidong Wu, Fan Ding, Rui Wang, Rui Shen, Xiwen Zhang, Shitong Luo, Chenpeng Su, Zuofan Wu, Qi Xie, Bonnie Berger, Jianzhu Ma, Jian Peng </authors>
    <reference>https://www.nature.com/articles/s41586-021-03819-2</reference>
    <category>Protein structure prediction</category>
    <doclink>https://github.com/deepmind/alphafold</doclink>
  </head>

  <command>omegafold</command>

<parameters>
<!-- command name: this parameter precedes all instruction strings -->
    <parameter ishidden="1" type="String"> 
	  <name>relion_invoke</name>
	  <attributes>
	    <format>
		  <language>perl</language>
		  <code>"omegafold"</code>

		</format>
		<group>0</group>
	  </attributes>
	</parameter> 
	  
<!-- build the conf file -->
	<parameter ishidden="1" type="String">
		<name>relion_scheduler</name>
		<attributes>
			<paramfile>scheduler.conf</paramfile>
			<format>
				<language>perl</language>
				<code>
<!-- RUN THESE JOBS ON Comet -->
				 "gpu=1\\n" . 
				 "runhours=1\\n" . 
			     "ntasks-per-node=1\\n" .
				 "nodes=1\\n"
				</code>
			</format>
			<group>1</group>
		</attributes>
	</parameter>	

<!-- create the non-configurable command line -->
<!--  -->
	<parameter ishidden="1" type="String">
		<name>relion_commandline</name>
		<attributes>
			<group>1</group>
		</attributes>
	</parameter>	

<!-- required input file, this is selected outside the parameters gui -->
    <parameter isinput = "1" type = "InFile">
	  <name>infile</name>
	  <attributes>
	    <prompt>FASTA file</prompt>
		<format>
		  <language>perl</language>
		  <code>"--fasta_paths=\"$value\""</code>
		</format>
	    <group>90</group>
	  </attributes>	  
	</parameter>
	
    <parameter type="Results">
      <name>stderr.txt</name>
      <attributes>
        <filenames>stderr</filenames>
      </attributes>
    </parameter>
	<parameter type="Integer">
      <name>num_cycles</name>
      <attributes>
        <group>1</group>
        <prompt>Number of cycles</prompt>
        <format>
          <language>perl</language>
          <code>"--num_cycle=$value"</code>
        </format>
        <vdef>
          <value>10</value>
        </vdef>
        <ctrls>
          <ctrl>
            <message>Please enter an integer > 0 for the number of cycles to use</message>
            <language>perl</language>
            <code>$num_cycles &lt; 0</code>
          </ctrl>
        </ctrls>
      </attributes>
    </parameter>

    <parameter type="Integer">
      <name>subbatch</name>
      <attributes>
        <group>1</group>
        <prompt>Subbatch size (size of sequence to use during prediction. Default = -1 is full sequence)</prompt>
        <format>
          <language>perl</language>
          <code>"--subbatch_size=$value"</code>
        </format>
        <vdef>
          <value>-1</value>
        </vdef>
      </attributes>
    </parameter>


	<parameter type="Results">
      <name>Input FASTA file</name>
      <attributes>
        <filenames>*.fasta</filenames>
      </attributes>
    </parameter>

    <parameter type="Results">
      <name>Predicted structural models</name>
      <attributes>
        <filenames>output_dir/*pdb</filenames>
      </attributes>
    </parameter>

</parameters>

</pise>
