<?xml version = "1.0" encoding = "UTF-8" ?>
<!DOCTYPE pise PUBLIC "pise2.dtd" "pise2.dtd"  [
<!ENTITY runtime_tg PUBLIC "run_time2.xml.in" "run_time2.xml.in" >
]>
<pise>
  <head>
    <title>LocBfactor Map Enhancement</title>
    <version>0.0</version>
    <description>Local computational methods to improve the interpretability and analysis of cryo-EM maps.</description>
    <authors>Kaur S, Gomez-Blanco J, Khalifa A, Adinarayanan S, Sanchez-Garcia R, Wrapp D, McLellan JS, Bui KH, Vargas J</authors>
    <reference>biorxiv.org/content/10.1101/2020.05.11.088013v2</reference>
    <category>Validation and Analysis</category>
    <doclink>https://github.com/1aviervargas/LocSpiral-LocBSharpen-LocBFactor-LocOccupancy</doclink>
  </head>

  <command>local_bfactor_sharpen</command>

<parameters>
<!-- command name: this parameter precedes all instruction strings -->
    <parameter ishidden="1" type="String"> 
	  <name>relion_invoke</name>
	  <attributes>
	    <format>
		  <language>perl</language>
		  <code>"local_bfactor_sharpen"</code>
		</format>
		<group>0</group>
	  </attributes>
	</parameter> 
	  
<!-- build the conf file -->
	<parameter ishidden="1" type="String">
		<name>relion_scheduler</name>
		<attributes>
			<paramfile>scheduler.conf</paramfile>
			<format>
				<language>perl</language>
				<code>
<!-- RUN THESE JOBS ON Comet -->
				 "runhours=1\\n" .
                 "ntasks-per-node=24\\n" .
                 "node_exclusive=1\\n" .
                 "nodes=1\\n"
				</code>
			</format>
			<group>1</group>
		</attributes>
	</parameter>

<!-- create the non-configurable command line -->
	<parameter ishidden="1" type="String">
		<name>relion_commandline</name>
		<attributes>
			<group>1</group>
		</attributes>
	</parameter>	

<!-- required input file, this is selected outside the parameters gui -->
    <parameter isinput = "1" type = "InFile">
	  <name>infile</name>
	  <attributes>
	    <prompt>Unfiltered half map 1 (unfiltered, not sharpened)</prompt>
		<format>
		  <language>perl</language>
		  <code>"--i \"$value\""</code>
		</format>
	    <group>90</group>
	  </attributes>	  
	</parameter>

	<parameter type="InFile" issimple="1">
        <name>half2</name>
        <attributes>
            <group>1</group>
            <prompt>Unfiltered half map 2 (unfiltered, not sharpened)</prompt>
            <format>
                <language>perl</language>
                <code>"--i2 $value"</code>
            </format>
        </attributes>
    </parameter>

	<parameter type="Float" ismandatory="1" issimple="1">
        <name>angpix</name>
        <attributes>
            <group>1</group>
            <prompt>Pixel size (Angstroms/pixel)</prompt>
            <format>
                <language>perl</language>
                <code>"--angpix $value"</code>
            </format>
            <ctrls>
                <ctrl>
                    <message>Please enter a float > 0.00 for the pixel size (in Angstroms/pix)</message>
                    <language>perl</language>
                    <code>$angpix &lt; 0.01</code>
                </ctrl>
            </ctrls>
        </attributes>
    </parameter>

    <parameter type="Float" ismandatory="1" issimple="1">
        <name>thresh</name>
        <attributes>
            <group>1</group>
            <prompt>Threshold to use for creating 3D mask from input half maps (from Chimera)</prompt>
            <format>
                <language>perl</language>
                <code>"--thresh $value"</code>
            </format>
        </attributes>
    </parameter>

	<parameter type="Float" ismandatory="1" issimple="1">
        <name>bhigh</name>
        <attributes>
            <group>1</group>
            <prompt>High resolution limit (global FSC resolution)</prompt>
            <format>
                <language>perl</language>
                <code>"--bfactor_max $value"</code>
            </format>
        </attributes>
    </parameter>

    <parameter type="Float" ismandatory="1">
        <name>bandwidth</name>
        <attributes>
            <group>1</group>
            <prompt>Bandwidth of the bandpass filter used in Fourier Space (Recommendations: If global resolution is less than 4A, use 3.5-5; If global resolution is greater than 4A, use 6-8)</prompt>
            <format>
                <language>perl</language>
                <code>"--bw $value"</code>
            </format>
            <vdef>
                <value>4.8</value>
            </vdef>
        </attributes>
    </parameter>

    <parameter type="Integer" ismandatory="1">
        <name>blow</name>
        <attributes>
            <group>1</group>
            <prompt>Advanced: Low resolution limit (Usually a value of 15-10 Angstroms works)</prompt>
            <format>
                <language>perl</language>
                <code>"--bfactor_min $value"</code>
            </format>
            <vdef>
                <value>15</value>
            </vdef>
        </attributes>
    </parameter>
	<parameter type="Float" ismandatory="1">
        <name>noise</name>
        <attributes>
            <group>1</group>
            <prompt>Advanced: Threshold for noise significance comparison</prompt>
            <format>
                <language>perl</language>
                <code>"--noise $value"</code>
            </format>
            <vdef>
                <value>0.95</value>
            </vdef>
        </attributes>
    </parameter>

	<parameter type="Switch">
        <name>highmem</name>
        <attributes>
            <group>1</group>
            <prompt>Advanced: Check box if your job is crashing because of memory issues</prompt>
            <format>
                <language>perl</language>
                <code>($value) ? " --highmem" : ""</code>
            </format>
            <vdef>
                <value>0</value>
            </vdef>
        </attributes>
    </parameter>

<!-- Files to transfer back -->
	<parameter type="Results">
      <name>Scheduler standard error</name>
      <attributes>
        <filenames>scheduler_stderr.txt</filenames>
      </attributes>
    </parameter>
	<parameter type="Results">
      <name>LocBfactor output</name>
      <attributes>
        <filenames>*locBfactor*.mrc</filenames>
      </attributes>
    </parameter>
<!-- visible input parameters -->	

</parameters>

</pise>
