<?xml version = "1.0" encoding = "UTF-8" ?>
<!DOCTYPE pise PUBLIC "pise2.dtd" "pise2.dtd"  [
<!ENTITY runtime_tg PUBLIC "run_time2.xml.in" "run_time2.xml.in" >
]>
<!-- Created by Mark Miller for CryoEM project around 5/24/2016-->
<pise>
  <head>
    <title>Model Angelo</title>
    <version>1.0.1</version>
    <description>Automatic atomic model building program for cryo-EM maps</description>
    <authors>Jamali K, Kimanius D, Scheres S</authors>
    <reference>https://www.biorxiv.org/content/10.1101/2023.05.16.541002v1</reference>
    <category>Model building</category>
    <doclink>https://github.com/3dem/model-angelo</doclink>
  </head>

  <command>modelangelo</command>

<parameters>
<!-- command name: this parameter precedes all instruction strings -->
    <parameter ishidden="1" type="String"> 
	  <name>relion_invoke</name>
	  <attributes>
	    <format>
		  <language>perl</language>
		  <code>"model_angelo build"</code>
		</format>
		<group>0</group>
	  </attributes>
	</parameter> 
	  
<!-- build the conf file -->
	<parameter ishidden="1" type="String">
		<name>relion_scheduler</name>
		<attributes>
			<paramfile>scheduler.conf</paramfile>
			<format>
				<language>perl</language>
				<code>
<!-- RUN THESE JOBS ON Comet -->
				 "gpu=1\\n" .
				 "runhours=3\\n" . 
			     "ntasks-per-node=6\\n" .
				 "nodes=1\\n"
				</code>
			</format>
			<group>1</group>
		</attributes>
	</parameter>	

<!-- create the non-configurable command line -->
<!--  -->
	<parameter ishidden="1" type="String">
		<name>relion_commandline</name>
		<attributes>
			<group>1</group>
		</attributes>
	</parameter>	

<!-- required input file, this is selected outside the parameters gui -->
    <parameter isinput = "1" type = "InFile">
	  <name>infile</name>
	  <attributes>
	    <prompt>3D reconstruction (sharpened map)</prompt>
		<format>
		  <language>perl</language>
		  <code>"-v \"$value\""</code>
		</format>
	    <group>90</group>
	  </attributes>	  
	</parameter>

	<parameter type="InFile" issimple="1">
        <name>proteinfasta</name>
        <attributes>
            <group>1</group>
            <prompt>Protein fasta sequence</prompt>
            <format>
                <language>perl</language>
                <code>"-f $value"</code>
            </format>
        </attributes>
    </parameter>

	<parameter type="InFile" issimple="1">
        <name>dnafasta</name>
        <attributes>
            <group>1</group>
            <prompt>DNA fasta sequence</prompt>
            <format>
                <language>perl</language>
                <code>"-df $value"</code>
            </format>
        </attributes>
    </parameter>

	<parameter type="InFile" issimple="1">
        <name>rnafasta</name>
        <attributes>
            <group>1</group>
            <prompt>RNA fasta sequence</prompt>
            <format>
                <language>perl</language>
                <code>"-rf $value"</code>
            </format>
        </attributes>
    </parameter>

	<parameter type="InFile" issimple="1">
        <name>mask</name>
        <attributes>
            <group>1</group>
            <prompt>(Optional) Mask</prompt>
            <format>
                <language>perl</language>
                <code>"-m $value"</code>
            </format>
        </attributes>
    </parameter>

	<parameter type="Switch">
        <name>noseq</name>
        <attributes>
            <group>1</group>
            <prompt>Build model without input sequence)</prompt>
            <format>
                <language>perl</language>
                <code>($value) ? " build_no_seq" : ""</code>
            </format>
            <vdef>
                <value>0</value>
            </vdef>
        </attributes>
    </parameter>	

<!-- Files to transfer back -->
	<parameter type="Results">
      <name>Full output</name>
      <attributes>
        <filenames>output.zip</filenames>
      </attributes>
    </parameter>

	<parameter type="Results">
      <name>Built models</name>
      <attributes>
        <filenames>output/*.cif</filenames>
      </attributes>
    </parameter>

	<parameter type="Results">
      <name>Log file</name>
      <attributes>
        <filenames>output/model_angelo.log</filenames>
      </attributes>
    </parameter>
<!-- visible input parameters -->	

</parameters>

</pise>
