<?xml version = "1.0" encoding = "UTF-8" ?>
<!DOCTYPE pise PUBLIC "pise2.dtd" "pise2.dtd"  [
<!ENTITY runtime_tg PUBLIC "run_time2.xml.in" "run_time2.xml.in" >
]>
<!-- Created by Mark Miller for CryoEM project around 5/24/2016-->
<pise>
  <head>
    <title>ARDECON</title>
    <version>1.0</version>
    <description>Deconvolution to restore cryo-EM maps with anisotropic resolution.</description>
    <authors>Li J, Chen Y, Zheng S, McDonald A, Sedat JW, Agard DA, Cheng Y</authors>
    <reference>https://www.biorxiv.org/content/10.1101/2025.02.23.639707v1</reference>
    <category>Validation and Analysis</category>
    <doclink>https://github.com/yifancheng-ucsf/AR-Decon</doclink>
  </head>

  <command>ardecon</command>

<parameters>
<!-- command name: this parameter precedes all instruction strings -->
    <parameter ishidden="1" type="String"> 
	  <name>relion_invoke</name>
	  <attributes>
	    <format>
		  <language>perl</language>
		  <code>"ardecon"</code>
		</format>
		<group>0</group>
	  </attributes>
	</parameter> 
	  
<!-- build the conf file -->
	<parameter ishidden="1" type="String">
		<name>relion_scheduler</name>
		<attributes>
			<paramfile>scheduler.conf</paramfile>
			<format>
				<language>perl</language>
				<code>
<!-- RUN THESE JOBS ON Comet -->
				 "runhours=1\\n" . 
			     "ntasks-per-node=1\\n" .
				 "nodes=1\\n"
				</code>
			</format>
			<group>1</group>
		</attributes>
	</parameter>	

<!-- create the non-configurable command line -->
<!--  -->
	<parameter ishidden="1" type="String">
		<name>relion_commandline</name>
		<attributes>
			<group>1</group>
		</attributes>
	</parameter>	

<!-- required input file, this is selected outside the parameters gui -->
    <parameter isinput = "1" type = "InFile">
	  <name>infile</name>
	  <attributes>
	    <prompt>3D reconstruction MRC file (full map; NOT sharpened)</prompt>
		<format>
		  <language>perl</language>
		  <code>"\"-i=$value\""</code>
		</format>
	    <group>90</group>
	  </attributes>	  
	</parameter>

	<parameter type="InFile" issimple="1" ismandatory="1">
        <name>half1</name>
        <attributes>
            <group>1</group>
            <prompt>Half map #1</prompt>
            <format>
                <language>perl</language>
                <code>"-i1=$value"</code>
            </format>
        </attributes>
    </parameter>

	<parameter type="InFile" issimple="1" ismandatory="1">
        <name>half2</name>
        <attributes>
            <group>1</group>
            <prompt>Half map #2.</prompt>
            <format>
                <language>perl</language>
                <code>"-i2=$value"</code>
            </format>
        </attributes>
    </parameter>

	<parameter type="InFile" issimple="1">
        <name>mask</name>
        <attributes>
            <group>1</group>
            <prompt>(Optional) Provide mask</prompt>
            <format>
                <language>perl</language>
                <code>"-m=$value"</code>
            </format>
        </attributes>
    </parameter>

	<parameter type="Float">
        <name>sigma</name>
        <attributes>
            <group>1</group>
            <prompt>Sigma value for generating OTF (default: auto-calculated).</prompt>
            <format>
                <language>perl</language>
                <code>"-sigma=$value"</code>
            </format>
        </attributes>
    </parameter>	

	<parameter type="Float" ismandatory="1">
        <name>smooth</name>
        <attributes>
            <group>1</group>
            <prompt>Smoothing parameter for deconvolution (default: 0.5).</prompt>
            <format>
                <language>perl</language>
                <code>"-smooth=$value"</code>
            </format>
			<vdef>
                <value>0.5</value>
            </vdef>
        </attributes>
    </parameter>
	
	<parameter type="Integer" ismandatory="1">
        <name>nonlin</name>
        <attributes>
            <group>1</group>
            <prompt>Nonlinearity parameter for deconvolution (default: 10000).</prompt>
            <format>
                <language>perl</language>
                <code>"-nonlin=$value"</code>
            </format>
            <vdef>
                <value>10000</value>
            </vdef>
        </attributes>
    </parameter>

	
<!-- Files to transfer back -->
	<parameter type="Results">
      <name>AR-DECON results</name>
      <attributes>
        <filenames>ardecon/*</filenames>
      </attributes>
    </parameter>
<!-- visible input parameters -->	

</parameters>

</pise>
