<?xml version = "1.0" encoding = "UTF-8" ?>
<!DOCTYPE pise PUBLIC "pise2.dtd" "pise2.dtd"  [
<!ENTITY runtime_tg PUBLIC "run_time2.xml.in" "run_time2.xml.in" >
]>
<!-- Created by Mark Miller for CryoEM project around 5/24/2016-->
<pise>
  <head>
    <title>RELION Postprocess</title>
    <version>3.1</version>
    <description>Sharpen and filter 3D reconstruction using RELION</description>
    <authors>S. H. W. Scheres</authors>
<!--
    <reference>Scheres, S. H. W. (2012) RELION: Implementation of a Bayesian approach to cryo-EM structure determination. Journal of Structural Biology 180, 519-530</reference>
 -->
	<reference>http://www.sciencedirect.com/science/article/pii/S104784771200248
1</reference>
    <category>RELION</category>
    <doclink>http://www2.mrc-lmb.cam.ac.uk/relion/index.php/Main_Page</doclink>
  </head>

  <command>relion_postprocess</command>
<!-- 
Per our conversation earlier today, I’m sending along a comet submission script for the analysis routine that will be a part of the gateway. 

First, you can look at an example submission script that I typically have used (‘relion_refine_submission.txt’). The cluster input variables are standard, 
and then there is a single command that will run using MPI. 

The barebones version of the command line input is the following (‘relion_refine_submission_base.txt’). I’ve bolded and underlined the areas that users 
will have to input: 

ibrun -v relion_refine_mpi  —o /path/to/working/directory/[output] -*auto_refine -*split_random_halves —i /path/to/working/directory/[input file] 
-*particle_diameter [user provided] —angpix [user provided] —ref /path/to/working/directory/[user provided] -*ini_high [user provided] -*ctf 
-*flatten_solvent -*zero_mask -*oversampling 1 -*healpix_order 2 -*auto_local_healpix_order 4 -*offset_range [user provided] -*offset_step [user provided] 
—sym [user provided] -*low_resol_join_halves 40 -*norm -*scale  -*j 1 -*memory_per_thread 4

A list of variables that I would change for these test run (or at least an initial list of variables):
—o Output file basename
—i Input file
—particle_diameter Diameter of particle (Angstroms)
—angpix Pixel size of data (A/pix)
—ref 3D model to use as template 
—ini_high Initial filter for 3D volume
—offset_range Pixel search range 
—offset_step Pixel search range step size
—sym Symmetry of sample 
I’m not sure what the next steps are for building out this command, but this is a definite start. There will be a few added changes to the submission command based upon users data, which we will incorporate into the gateway job template page.



Let me know what else I can do to help!
Mike -->

<parameters>
<!-- command name: this parameter precedes all instruction strings -->
    <parameter ishidden="1" type="String"> 
	  <name>relion_invoke</name>
	  <attributes>
	    <format>
		  <language>perl</language>
		  <code>"relion_postprocess"</code>
		</format>
		<group>0</group>
	  </attributes>
	</parameter> 
	  
<!-- build the conf file -->
	<parameter ishidden="1" type="String">
		<name>relion_scheduler</name>
		<attributes>
			<paramfile>scheduler.conf</paramfile>
			<format>
				<language>perl</language>
				<code>
<!-- RUN THESE JOBS ON Comet -->
                 "runhours=1\\n" .
                 "ChargeFactor=1.0\\n" .
                 "ntasks-per-node=1\\n" .
                 "cores_per_node=1\\n" .
                 "nodes=1\\n"
				</code>
			</format>
			<group>1</group>
		</attributes>
	</parameter>	

	<parameter isinput = "1" type = "InFile">
      <name>infile</name>
      <attributes>
        <prompt>3D reconstruction MRC file (half map 1; NOT sharpened)</prompt>
        <format>
          <language>perl</language>
          <code>"--i \"$value\""</code>
        </format>
        <group>90</group>
      </attributes>
    </parameter>

	<parameter type="Results">
      <name>stderr.txt</name>
      <attributes>
        <filenames>stderr</filenames>
      </attributes>
    </parameter>

	<parameter type="Results">
      <name>Sharpened map</name>
      <attributes>
        <filenames>postprocess.mrc</filenames>
      </attributes>
    </parameter>

	<parameter type="Results">
      <name>Postprocess STAR file</name>
      <attributes>
        <filenames>postprocess.star</filenames>
      </attributes>
    </parameter>

	<parameter type="InFile" issimple="1" ismandatory="1">
        <name>half2</name>
        <attributes>
            <group>1</group>
            <prompt>3D reconstruction MRC file (half map 2; NOT sharpened)</prompt>
            <format>
                <language>perl</language>
                <code>"--i2 $value"</code>
            </format>
            <ctrls>
                <ctrl>
                    <message>Please choose a 3D volume</message>
                    <language>perl</language>
                    <code>!$half2</code>
                </ctrl>
            </ctrls>
        </attributes>
    </parameter>

	<parameter type="InFile" issimple="1" ismandatory="1">
        <name>mask</name>
        <attributes>
            <group>1</group>
            <prompt>3D mask MRC file</prompt>
            <format>
                <language>perl</language> 
                <code>"--mask $value"</code>
            </format>
            <ctrls>
                <ctrl>
                    <message>Please choose a 3D volume</message>
                    <language>perl</language>
                    <code>!$mask</code>
                </ctrl>
            </ctrls>
        </attributes>
    </parameter>

	<parameter type="InFile">
        <name>mtf</name>
        <attributes>
            <group>1</group>
            <prompt>MTF of the detector (STAR file) (Optional)</prompt>
            <format>
                <language>perl</language>
                <code>"--mtf $value"</code>
            </format>
        </attributes>
    </parameter>

	<parameter type="Float" ismandatory="1" issimple="1">
        <name>angpix</name>
        <attributes>
            <group>1</group>
            <prompt>Pixel size of reconstruction (Angstroms/pixel)</prompt>
            <format>
                <language>perl</language>
                <code>"--angpix $value"</code>
            </format>
            <ctrls>
                <ctrl>
                    <message>Please enter a float > 0.00 for the pixel size (in Angstroms/pix)</message>
                    <language>perl</language>
                    <code>$angpix &lt; 0.01</code>
                </ctrl>
            </ctrls>
        </attributes>
    </parameter>

	<parameter type="Float" >
        <name>orig_angpix</name>
        <attributes>
            <group>1</group>
            <prompt>Original detector pixel size (Angstroms/pixel)</prompt>
            <format>
                <language>perl</language>
                <code>"--mtf_angpix $value"</code>
            </format>
        </attributes>
    </parameter>

	<parameter type="Float">
        <name>skip_filt</name>
        <attributes>
            <group>1</group>
            <prompt>Ad-hoc low pass filter (if provided, will skip FSC-weighting)</prompt>
            <format>
                <language>perl</language>
                <code>"--skip_fsc_weighting --lowpass $value"</code>
            </format>
        </attributes>
    </parameter>	
	
    <parameter type="Integer">
	    <name>bfactor_res</name>
	    <attributes>
		    <group>1</group>
		    <prompt>Lowest resolution for automatic B-factor estimation</prompt>
		    <format>
			    <language>perl</language>
			    <code>"--autob_lowres $value"</code>
		    </format>
			<vdef>
                <value>10</value>
            </vdef>
		    <ctrls>
			    <ctrl>
                    <message>Please enter an integer > 0</message>
				    <language>perl</language>
				    <code>$bfactor_res &lt; 1</code>
			    </ctrl>
		    </ctrls>
	    </attributes>
    </parameter>

    <parameter type="Integer" >
        <name>ownbfactor</name>
        <attributes>
            <group>1</group>
            <prompt>User-provided B-factor (if provided, it will override automatic B-factor)</prompt>
            <format>
                <language>perl</language>
                <code>"--adhoc_bfac $value"</code>
            </format>
            <ctrls>
                <ctrl>
                    <message>B-factors for sharpening should be negative. Please enter an integer less than 0</message>
                    <language>perl</language>
                    <code>$ownbfactor &gt; 0</code>
                </ctrl>
            </ctrls>
        </attributes>
    </parameter>

</parameters>

</pise>
